### ISSUE TITLE
Livestream stopped working after many months working fine

### ISSUE THREAD

**Issue by galmeida** [dgreif/ring#272]
# Live Streaming Issue

### Describe the live streaming issue

Livestream stopped working after many months working fine.
Stream fails with a still image from the camera and the message: No Response. This camera is not responding.

Stream works fine on ring app.

### Screenshots/Logs
[3/26/2020, 3:32:11 AM] [Ring] Preparing Live Stream for Backyard
[3/26/2020, 3:36:52 AM] [Ring] Ding XXXXXXXXXXXXX is expired (480).  Fetching a new ding and trying video stream again
[3/26/2020, 3:36:52 AM] [Ring] Waiting for stream data from Backyard (281.238s)
[3/26/2020, 3:36:53 AM] [Ring] Received stream data from Backyard (281.864s)

### Recommended solution

My network setup is complex (description bellow) so I don't expect any software change to fix my issue. I'm seeking information so I can understand what's going on myself.

One thing that caught my attention is the huge interval (4+ minutes) between "Preparing Live Stream" and "Waiting for stream". Also Received stream is the last message, after that I see no error and no "Streaming active". 

I can also notice that even though Home app has long failed by the time I get the received stream, there's still a stream of UDP packets coming from ring servers to homebridge and form homebridge to my phone, sample bellow. (AppleTV seems to be out of the loop for some reason). 

#### Questions

1. Is there a documentation on how the stream works? what requests are dispatched to what entities? How data flows between ring servers, homebridge, HomeKit bridge (AppleTV), and the device visualizing the stream?

2. Does the long interval between "preparing" and "waiting for stream" rings any bell to you?

3. It's been 30 minutes since I last tried to visualize the livestream and the UDP packet stream is still flowing, I think that might need to be addressed as a bug as it could cause issues for customers with limited bandwidth or data caps.

### Environment

 - Ring Camera: wired floodlight cam
 - OS: Raspbian 9
 - Node.js: v12.16.1
 - NPM: 6.13.7
 - homebridge-ring (if applicable): 7.2.1
 - homebridge (if applicable): 0.4.53
 - iOS 13.4
 - tvOS 13.4

### Network Environment

Cameras, Homebridge and AppleTV connected to same network, all three devices have full access to internet and to each other.

Phone is on a separate network with full access to AppleTV, Homebridge, Camera and internet. Homebridge has limited access to the phone (only stablished connections and the UDP stream)

### Packet capture sample

```
03:46:37.893962 IP HOMEBRIDGE.45269 > PHONE.56863: UDP, length 1222
03:46:37.905652 IP 34.221.174.109.17494 > HOMEBRIDGE.42511: UDP, length 1222
03:46:37.905969 IP HOMEBRIDGE.45269 > PHONE.56863: UDP, length 1222
03:46:37.907576 IP 34.221.174.109.17494 > HOMEBRIDGE.42511: UDP, length 1222
03:46:37.907862 IP HOMEBRIDGE.45269 > PHONE.56863: UDP, length 1222
03:46:37.911364 IP 34.221.174.109.39670 > HOMEBRIDGE.40381: UDP, length 182
03:46:37.919608 IP 34.221.174.109.17494 > HOMEBRIDGE.42511: UDP, length 1222
03:46:37.919965 IP HOMEBRIDGE.45269 > PHONE.56863: UDP, length 1222
03:46:37.921623 IP 34.221.174.109.17494 > HOMEBRIDGE.42511: UDP, length 1222
03:46:37.921912 IP HOMEBRIDGE.45269 > PHONE.56863: UDP, length 1222
03:46:37.923604 IP 34.221.174.109.17494 > HOMEBRIDGE.42511: UDP, length 1222
03:46:37.923886 IP HOMEBRIDGE.45269 > PHONE.56863: UDP, length 1222
03:46:37.931380 IP 34.221.174.109.39670 > HOMEBRIDGE.40381: UDP, length 182
03:46:37.932646 IP HOMEBRIDGE.51842 > PHONE.57953: UDP, length 122
03:46:37.936145 IP 34.221.174.109.17494 > HOMEBRIDGE.42511: UDP, length 1222
03:46:37.936516 IP HOMEBRIDGE.45269 > PHONE.56863: UDP, length 1222
03:46:37.938072 IP 34.221.174.109.17494 > HOMEBRIDGE.42511: UDP, length 1222
03:46:37.938375 IP HOMEBRIDGE.45269 > PHONE.56863: UDP, length 1222
03:46:37.950340 IP 34.221.174.109.17494 > HOMEBRIDGE.42511: UDP, length 1161
03:46:37.950633 IP HOMEBRIDGE.45269 > PHONE.56863: UDP, length 1161
03:46:37.951377 IP 34.221.174.109.39670 > HOMEBRIDGE.40381: UDP, length 182
03:46:37.952519 IP 34.221.174.109.17494 > HOMEBRIDGE.42511: UDP, length 36
03:46:37.952955 IP HOMEBRIDGE.45269 > PHONE.56863: UDP, length 36
03:46:37.953349 IP HOMEBRIDGE.51842 > PHONE.57953: UDP, length 127
03:46:37.954426 IP 34.221.174.109.17494 > HOMEBRIDGE.42511: UDP, length 1222
03:46:37.954760 IP HOMEBRIDGE.45269 > PHONE.56863: UDP, length 1222
```

**Comment by galmeida** [comment]
I found the issue, and TBH that was quite surprising to me. On my network, requests to externa DNS servers are blocked, all hosts are configured to use an internal DNS, despite that, some code in homebridge or homebridge-ring was still trying to dispatch DNS requests to external servers, and having those blocked caused the issue above, after allowing hombridge to dispatch requests to external DNSs, streams worked fine.

### Action Item Suggestion

* Add this information and failure mode to [Camera Troubleshooting](https://github.com/dgreif/ring/wiki/Camera-Troubleshooting)
* Investigate a way to stop the UDP stream if stream ever starts

**Comment by dgreif** [comment]
Thanks for the detailed report, and I’m really glad you were able to track down the issue! The wiki should be editable by anyone, so you are welcome to add some additional information based on your experience. Just let me know when you are done and I can take a look at what you changed. As for stopping the stream, I’ve investigated this a bit in the past, but it’s a tough situation. I stop the stream whenever homebridge tells me your phone is done with it, but there can be cases where homebridge never tells me to stop. I could check to verify that I am still recording packets from the homebridge side, but I’m afraid that would lead to premature disconnects

**Comment by galmeida** [comment]
Thanks, I will add something to the wiki about my experience.

Regarding stopping the stream, do you think it would be worth to stop the stream after 15 or 30 minutes even if the "phone is done" event is not received?

**Comment by galmeida** [comment]
Wiki edit done

**Comment by donavanbecker** [comment]
@galmeida so did you open up that port to your HomeBridge server?

**Comment by dgreif** [comment]
Thanks for the wiki update @galmeida. 

Stopping the stream after 15 or 30 minutes would be an issue for some users who use use homebridge to continuously view the camera throughout the day.  I'll continue to think about ways to detect an unused stream.

**Comment by galmeida** [comment]
> @galmeida so did you open up that port to your Homebridge server?

Is I did, in fact the port was blocked by my gateway, allowing the host running homebridge to send DNS queries to external servers fixed that issue for me.

**Comment by donavanbecker** [comment]
@galmeida that didn't work for me.
